<?xml version="1.0" encoding="utf-8" ?>
<DialoguesDatas xmlns:xsi="http://www.w3.org/2001/XMLSchema-instance" xsi:noNamespaceSchemaLocation="DialoguesDatas.xsd">

   <DialogueDatas Id="Twitter">
      <InvertPortraitsAnchors/>
      <Sequence>
         <!--<AddItem Id="Ring_00" Quantity="666"/>-->
         <!--<AddItem Id="Scroll"/>-->
         <Sentence Id="Twitter_00"/>
         <Pause Dur="0.5"/>
         <Sentence Id="Twitter_01"/>
         <Sentence Id="Twitter_02"/>
         <!--<RemoveItem Id="Ring_00" Quantity="333"/>-->
         <!--<RemoveItem Id="Ring_01" />-->
         <Sentence Id="Twitter_03"/>
         <Sentence Id="Twitter_04"/>
         <Pause Dur="0.5"/>
         <Sentence Id="Twitter_05"/>
      </Sequence>
   </DialogueDatas>

   <SentenceDatas Id="Twitter_00">
      <Speaker Id="Templar">
         <HideSpeakerName/>
      </Speaker>
      <Value>Hey there. Who are you ?</Value>
   </SentenceDatas>

   <SentenceDatas Id="Twitter_01">
      <Speaker Id="SpeakerPlaceholder">
         <HideSpeakerName/>
         <OverridePortraitId>Unknown</OverridePortraitId>
      </Speaker>
      <Value>[pause=0.3].[pause=0.3].[pause=0.3].</Value>
   </SentenceDatas>

   <SentenceDatas Id="Twitter_02">
      <Speaker Id="SpeakerPlaceholder">
         <OverrideDisplayName>Bob</OverrideDisplayName>
         <HideSpeakerName/>
      </Speaker>
      <Value>I'm Bob.</Value>
   </SentenceDatas>

   <SentenceDatas Id="Twitter_03">
      <Speaker Id="Templar">
         <HideSpeakerName/>
      </Speaker>
      <Value>[pause=0.1].[pause=0.1].[pause=0.1].</Value>
   </SentenceDatas>

   <SentenceDatas Id="Twitter_04">
      <Speaker Id="Templar">
         <HideSpeakerName/>
      </Speaker>
      <Value>I'm getting short on imagination for those gifs...</Value>
   </SentenceDatas>

   <SentenceDatas Id="Twitter_05">
      <Speaker Id="Templar">
         <HideSpeakerName/>
      </Speaker>
      <Value>But hopefully, you can see the dialogue system progress ! :D</Value>
   </SentenceDatas>

</DialoguesDatas>