<?xml version="1.0" encoding="utf-8" ?>
<DialoguesDatas xmlns:xsi="http://www.w3.org/2001/XMLSchema-instance" xsi:noNamespaceSchemaLocation="DialoguesDatas.xsd">

   <!-- ███████████ -->
   <!--  DIALOGUES  -->
   <!-- ███████████ -->

   <DialogueDatas Id="Godric_Greeting">
      <Sequence>
         <Sentence Id="Godric_Greeting_00"/>
         <Sentence Id="Godric_Greeting_01"/>
         <Sentence Id="Godric_Greeting_02"/>
         <Sentence Id="Godric_Greeting_03"/>
         <Sentence Id="Godric_Greeting_04"/>
         <AddItem Id="Key_Godric_House"/>
         <Sentence Id="Godric_Greeting_05"/>
      </Sequence>
   </DialogueDatas>

   <DialogueDatas Id="Godric_Greeting_Ring">
      <Sequence>
         <Sentence Id="Godric_Greeting_Ring_00"/>
         <Sentence Id="Godric_Greeting_Ring_01"/>
         <Sentence Id="Godric_Greeting_Ring_02"/>
         <Sentence Id="Godric_Greeting_Ring_03"/>
         <RemoveItem Id="Ring_Godric"/>
      </Sequence>
   </DialogueDatas>

   <DialogueDatas Id="Godric_WaitingRing">
      <Sequence>
         <Sentence Id="Godric_WaitingRing_00"/>
         <Sentence Id="Godric_WaitingRing_01"/>
      </Sequence>
   </DialogueDatas>

   <DialogueDatas Id="Godric_RetrieveRing">
      <Sequence>
         <Sentence Id="Godric_RetrieveRing_00"/>
         <RemoveItem Id="Ring_Godric"/>
         <Sentence Id="Godric_RetrieveRing_01"/>
         <Sentence Id="Godric_RetrieveRing_02"/>
         <Sentence Id="Godric_RetrieveRing_03"/>
         <Sentence Id="Godric_RetrieveRing_04"/>
         <AddItem Id="Potion"/>
      </Sequence>
   </DialogueDatas>

   <DialogueDatas Id="Godric_PostRetrieveRing">
      <Sequence>
         <Sentence Id="Godric_PostRetrieveRing_00"/>
      </Sequence>
   </DialogueDatas>

   
   <!-- ███████████ -->
   <!--  SENTENCES  -->
   <!-- ███████████ -->

   <SentenceDatas Id="Godric_Greeting_00">
      <Speaker Id="Godric">
         <OverrideDisplayName>???</OverrideDisplayName>
      </Speaker>
   </SentenceDatas>

   <SentenceDatas Id="Godric_Greeting_01">
      <Speaker Id="Godric">
         <OverrideDisplayName>???</OverrideDisplayName>
      </Speaker>
   </SentenceDatas>

   <SentenceDatas Id="Godric_Greeting_02">
      <Speaker Id="Godric">
         <OverrideDisplayName>???</OverrideDisplayName>
      </Speaker>
   </SentenceDatas>

   <SentenceDatas Id="Godric_Greeting_03">
      <Speaker Id="Godric">
         <OverrideDisplayName>???</OverrideDisplayName>
      </Speaker>
   </SentenceDatas>

   <SentenceDatas Id="Godric_Greeting_04">
      <Speaker Id="Godric">
         <OverrideDisplayName>???</OverrideDisplayName>
      </Speaker>
   </SentenceDatas>

   <SentenceDatas Id="Godric_Greeting_05">
      <Speaker Id="Godric">
         <OverrideDisplayName>???</OverrideDisplayName>
      </Speaker>
   </SentenceDatas>


   <SentenceDatas Id="Godric_Greeting_Ring_00">
      <Speaker Id="Godric">
         <OverrideDisplayName>???</OverrideDisplayName>
      </Speaker>
   </SentenceDatas>

   <SentenceDatas Id="Godric_Greeting_Ring_01">
      <Speaker Id="Godric">
         <OverrideDisplayName>???</OverrideDisplayName>
      </Speaker>
   </SentenceDatas>

   <SentenceDatas Id="Godric_Greeting_Ring_02">
      <Speaker Id="Godric">
         <OverrideDisplayName>???</OverrideDisplayName>
      </Speaker>
   </SentenceDatas>

   <SentenceDatas Id="Godric_Greeting_Ring_03">
      <Speaker Id="Godric"/>
   </SentenceDatas>
   
   
   <SentenceDatas Id="Godric_WaitingRing_00">
      <Speaker Id="Godric"/>
   </SentenceDatas>

   <SentenceDatas Id="Godric_WaitingRing_01">
      <Speaker Id="Godric"/>
   </SentenceDatas>
   
   
   <SentenceDatas Id="Godric_RetrieveRing_00">
      <Speaker Id="Godric"/>
   </SentenceDatas>

   <SentenceDatas Id="Godric_RetrieveRing_01">
      <Speaker Id="Godric"/>
   </SentenceDatas>

   <SentenceDatas Id="Godric_RetrieveRing_02">
      <Speaker Id="Godric"/>
   </SentenceDatas>

   <SentenceDatas Id="Godric_RetrieveRing_03">
      <Speaker Id="Godric"/>
   </SentenceDatas>

   <SentenceDatas Id="Godric_RetrieveRing_04">
      <Speaker Id="Godric"/>
   </SentenceDatas>

   <SentenceDatas Id="Godric_PostRetrieveRing_00">
      <Speaker Id="Godric"/>
   </SentenceDatas>
   
</DialoguesDatas>