<?xml version="1.0" encoding="utf-8" ?>
<DialoguesDatas xmlns:xsi="http://www.w3.org/2001/XMLSchema-instance" xsi:noNamespaceSchemaLocation="DialoguesDatas.xsd">

   <DialogueDatas Id="NPCDial_00">
      <Sequence>
         <Sentence Id="NPCDial_00_Sentence_00"/>
         <Pause Dur="0.5"/>
         <Sentence Id="NPCDial_00_Sentence_01"/>
         <AddItem Id="Test"/>
         <Sentence Id="NPCDial_00_Sentence_02"/>
         <Sentence Id="NPCDial_00_Sentence_NameReveal"/>
         <Sentence Id="NPCDial_00_Sentence_03"/>
         <Pause Dur="0.5"/>
         <Sentence Id="NPC_Ellipsis"/>
         <Sentence Id="NPCDial_00_Sentence_04"/>
      </Sequence>
   </DialogueDatas>

   <SentenceDatas Id="NPCDial_00_Sentence_00">
      <Speaker Id="SpeakerPlaceholder">
         <OverrideDisplayName>???</OverrideDisplayName>
         <OverridePortraitId>Unknown</OverridePortraitId>
      </Speaker>
   </SentenceDatas>

   <SentenceDatas Id="NPCDial_00_Sentence_01">
      <Speaker Id="SpeakerPlaceholder">
         <OverrideDisplayName>???</OverrideDisplayName>
         <OverridePortraitId>Unknown</OverridePortraitId>
      </Speaker>
   </SentenceDatas>

   <SentenceDatas Id="NPCDial_00_Sentence_02">
      <Speaker Id="Templar"/>
   </SentenceDatas>

   <SentenceDatas Id="NPCDial_00_Sentence_NameReveal">
      <Speaker Id="SpeakerPlaceholder"/>
   </SentenceDatas>

   <SentenceDatas Id="NPCDial_00_Sentence_03">
      <Speaker Id="SpeakerPlaceholder"/>
   </SentenceDatas>

   <SentenceDatas Id="NPCDial_00_Sentence_04">
      <Speaker Id="SpeakerPlaceholder"/>
   </SentenceDatas>

   <SentenceDatas Id="NPC_Ellipsis">
      <Speaker Id="SpeakerPlaceholder">
         <HideSpeakerName/>
      </Speaker>
   </SentenceDatas>
   
</DialoguesDatas>