<?xml version="1.0" encoding="utf-8" ?>
<DialoguesDatas xmlns:xsi="http://www.w3.org/2001/XMLSchema-instance" xsi:noNamespaceSchemaLocation="DialoguesDatas.xsd">

   <DialogueDatas Id="StoneSign_00">
      <HidePortraitBox/>
      <Sequence>
         <Sentence Id="StoneSign_00_Sentence_00"/>
      </Sequence>
   </DialogueDatas>

   <DialogueDatas Id="StoneSign_01">
      <HidePortraitBox/>
      <Sequence>
         <Sentence Id="StoneSign_01_Sentence_00"/>
         <Sentence Id="StoneSign_01_Sentence_01"/>
      </Sequence>
   </DialogueDatas>

   <DialogueDatas Id="StoneSign_02">
      <HidePortraitBox/>
      <Sequence>
         <Sentence Id="StoneSign_02_Sentence_00"/>
      </Sequence>
   </DialogueDatas>

   <DialogueDatas Id="StoneSign_CatacombsEntry">
      <HidePortraitBox/>
      <Sequence>
         <Sentence Id="StoneSign_CatacombsEntry_Sentence_00"/>
      </Sequence>
   </DialogueDatas>

   <DialogueDatas Id="StoneSign_RatKing">
      <!--<HidePortraitBox/>-->
      <Sequence>
         <Sentence Id="StoneSign_RatKing_Sentence_00"/>
         <Sentence Id="StoneSign_RatKing_Sentence_01"/>
      </Sequence>
   </DialogueDatas>

   <DialogueDatas Id="StoneSign_SecretWallHint">
      <!--<HidePortraitBox/>-->
      <Sequence>
         <Sentence Id="StoneSign_SecretWallHint_00"/>
         <Sentence Id="StoneSign_SecretWallHint_01"/>
         <Pause Dur="0.5"/>
         <Sentence Id="StoneSign_SecretWallHint_02"/>
      </Sequence>
   </DialogueDatas>
   

   <SentenceDatas Id="StoneSign_00_Sentence_00">
      <Speaker Id="Templar">
         <HidePortraitBox/>
         <HideSpeakerName/>
      </Speaker>
   </SentenceDatas>

   <SentenceDatas Id="StoneSign_01_Sentence_00">
      <Speaker Id="Templar">
         <HidePortraitBox/>
         <HideSpeakerName/>
      </Speaker>
   </SentenceDatas>

   <SentenceDatas Id="StoneSign_01_Sentence_01">
      <Speaker Id="Templar">
         <HidePortraitBox/>
         <HideSpeakerName/>
      </Speaker>
   </SentenceDatas>

   <SentenceDatas Id="StoneSign_02_Sentence_00">
      <Speaker Id="Templar">
         <HidePortraitBox/>
         <HideSpeakerName/>
      </Speaker>
   </SentenceDatas>

   <SentenceDatas Id="StoneSign_CatacombsEntry_Sentence_00">
      <Speaker Id="Templar">
         <HidePortraitBox/>
         <HideSpeakerName/>
      </Speaker>
   </SentenceDatas>

   <SentenceDatas Id="StoneSign_RatKing_Sentence_00">
      <Speaker Id="Templar">
         <HidePortraitBox/>
         <HideSpeakerName/>
      </Speaker>
   </SentenceDatas>

   <SentenceDatas Id="StoneSign_RatKing_Sentence_01">
      <Speaker Id="Templar">
         <HideSpeakerName/>
      </Speaker>
   </SentenceDatas>

   <SentenceDatas Id="StoneSign_SecretWallHint_00">
      <Speaker Id="Templar">
         <HidePortraitBox/>
         <HideSpeakerName/>
      </Speaker>
   </SentenceDatas>

   <SentenceDatas Id="StoneSign_SecretWallHint_01">
      <Speaker Id="Templar">
         <HidePortraitBox/>
         <HideSpeakerName/>
      </Speaker>
   </SentenceDatas>

   <SentenceDatas Id="StoneSign_SecretWallHint_02">
      <Speaker Id="Templar">
         <HideSpeakerName/>
      </Speaker>
   </SentenceDatas>
   
</DialoguesDatas>